{"schemaVersion":"1.0.0","generatedAt":"2026-10-17T16:24:34-04:00","preferences":{"schemaVersion":"1.0.0","profileId":"household","updatedAt":null,"topicAffinities":{},"venueAffinities":{},"newsTopicAffinities":{},"favorites":[],"hiddenOccurrences":[],"overrides":{},"constraints":{"maxDistanceMiles":null,"selectedDayOnly":false},"ranking":{"version":1,"limit":7,"maxPerVenue":2,"maxPerCategory":3,"maxPerSeries":1,"minScore":35,"horizonDays":30},"editorial":{"newsFocus":["Canton and Plymouth","nearby public services and household costs","local civic decisions","environment","eclectic live arts","notable nearby food openings"],"scienceInterests":["astronomy","physics","engineering","technology","biology","health","earth-science"]}},"weights":{"rulesVersion":2,"base":0.5,"scale":100,"signals":{"distinctive":{"weight":0.24,"polarity":"positive"},"eclectic":{"weight":0.16,"polarity":"positive"},"technical_science":{"weight":0.14,"polarity":"positive"},"funny":{"weight":0.12,"polarity":"positive"},"artsy":{"weight":0.1,"polarity":"positive"},"progressive":{"weight":0.08,"polarity":"positive"},"theatre":{"weight":0.12,"polarity":"positive"},"outdoors":{"weight":0.1,"polarity":"positive"},"live_music":{"weight":0.12,"polarity":"positive"},"live_comedy":{"weight":0.12,"polarity":"positive"},"farmer_market":{"weight":0.26,"polarity":"positive"},"recurring":{"weight":0,"polarity":"negative"},"sporting":{"weight":0.3,"polarity":"negative"},"large_venue":{"weight":0.24,"polarity":"negative"},"craft_fair_shopping":{"weight":0.2,"polarity":"negative"},"religious":{"weight":0.16,"polarity":"negative"},"substance_recovery":{"weight":0.24,"polarity":"negative"},"popular_music_cover_band":{"weight":0.2,"polarity":"negative"},"market_or_shop":{"weight":0.24,"polarity":"negative"},"punk_metal_or_rock":{"weight":0.2,"polarity":"negative"},"dance":{"weight":0.16,"polarity":"negative"},"sales_related":{"weight":0.24,"polarity":"negative"},"children_activity":{"weight":0.4,"polarity":"negative"},"running":{"weight":0.2,"polarity":"negative"},"exercise":{"weight":0.2,"polarity":"negative"},"employment_related":{"weight":0.24,"polarity":"negative"}}}}